,company,address,country,year
216,Intel Corp.,"No. 8-1 Kexin Road, High-Tech Zone (West Park), Chengdu, Sichuan, China",China,2016
217,Intel Corp.,"109 Huaihe East Road, Dalian, Liaoning, China",China,2016
218,Intel Corp.,"Collinstown Industrial Park, Leixlip, Ireland",Ireland,2016
219,Intel Corp.,"New Industrial Area 2 Tzoran Street, Kiryat Gat, Israel",Israel,2016
220,Intel Corp.,"Bayan Lepas Industrial Park IV, Penang, Malaysia",Malaysia,2016
221,Intel Corp.,"4500 South Dobson Road, Chandler, Arizona, United States",United States,2016
222,Intel Corp.,"2501 NW 229th Avenue, Hillsboro, Oregon, United States",United States,2016
223,Intel Corp.,"Rio Rancho Blvd SE, Rio Rancho, New Mexico, United States",United States,2016
224,Intel Corp.,"Lot I2, Saigon Hi-Tech Park, District 9, Ho Chi Minh, Binh Duong, Vietnam",Vietnam,2016
225,"Interflex Co., Ltd.","600 Sunggok-dong, Danwon-gu, Ansan, Gyeonggi-Do, South Korea",South Korea,2016
226,Intramedia Inc.,"No. 11 Haiyi Road, Ching Tou Village, Changan Town, Dongguan, Guangdong, China",China,2016
227,Intramedia Inc.,"No. 189, Tangzhuang Road, Suzhou Industrial Park, Suzhou, Jiangsu, China",China,2016
228,InvenSense Inc.,"1F, 9 Prosperity 1st Road, Hsinchu, Taiwan",Taiwan,2016
229,Inventec Corp.,"No. 789, Puxing Road, Minhang District, Shanghai, China",China,2016
230,Jabil Circuit Inc.,"No. 1, Section 3, Chuangxin Road, Chongzhou Economic Development District, Chengdu, Sichuan, China",China,2016
231,Jabil Circuit Inc.,"128 Juncheng Road, Guangzhou Economic and Technology Development Zone, Guangzhou, Guangdong, China",China,2016
232,Jabil Circuit Inc.,"No. 1199, Hulin Road, Huangpu District, Guangzhou, Guangdong, China",China,2016
233,Jabil Circuit Inc.,"Ganpi Village, Zhenlong Town, Huiyang District, Huizhou, Guangdong, China",China,2016
234,Jabil Circuit Inc.,"No. 2073, Jincheng Road, Shajing Street, Baoan District, Shenzhen, Guangdong, China",China,2016
235,Jabil Circuit Inc.,"No. 7 Yang Qing Road, Lou Feng Demonstrative S.I.P, Suzhou, Jiangsu, China",China,2016
236,Jabil Circuit Inc.,"No. 21, Sai Da Shi Ji Road, Xiqing Economic Development Zone, Tianjin, China",China,2016
237,Jabil Circuit Inc.,"Lot J9, J10 Export Processing Zone, Wuxi, Jiangsu, China",China,2016
238,Jabil Circuit Inc.,"No. 84-2. Block B, National Hi-Tech Industrial Development Zone, Wuxi, Jiangsu, China",China,2016
239,Jabil Circuit Inc.,"No. 266, Section 1, Shen-Lin Road, Taichung, Taiwan",Taiwan,2016
240,Japan Aviation Electronics Industry Ltd.,"5-1, Oaza Seinofukuro 5-chome, Hirosaki, Aomori, Japan",Japan,2016
241,Japan Aviation Electronics Industry Ltd.,"4102-6, Aza Takadaishinden, Oaza Izumida, Shinjo, Yamagata, Japan",Japan,2016
242,Japan Display Inc.,"Xinyang road Dengwu Village, Qiaotou Town, Dongguan, Guangdong, China",China,2016
243,Japan Display Inc.,"No. 1, Central Avenue, Area B, Kunshan Free Trade Zone, Kunshan, Jiangsu, China",China,2016
244,Japan Display Inc.,"26-2, Yamadasenden, Kawakita, Nomi-gun, Ishikawa, Japan",Japan,2016
245,Japan Display Inc.,"3300 Hayano, Mobara, Chiba, Japan",Japan,2016
246,Japan Display Inc.,"1-47, Iwauchi-machi, Nomi, Ishikawa, Japan",Japan,2016
247,"Jeou Uei Co., Ltd.","No. 5-1 GuGang Road, ChengQu Industrial Park, Economic Development Zone, Taicang, Jiangsu, China",China,2016
248,"Kantatsu Co., Ltd.","No. 8, Xinlong Road Xinpu Economic Development Zone, Lianyungang, Jiangsu, China",China,2016
249,Kemet Corp.,"No. 99, Yangpu Road, Suzhou, Jiangsu, China",China,2016
250,Kemet Corp.,"Lot 336, Batamindo Industry Park, Jl. Gaharu, Muka Kuning, Nongsa, Kota Batam, Kepulauan Riau, Indonesia",Indonesia,2016
251,Kemet Corp.,"Av. Carlos Salazar y Bulevar Manuel Cavazos Lerma No. 15, H. Matamoros, Tamaulipas, Mexico",Mexico,2016
252,Kemet Corp.,"Av. las Americas 780 Ote., Colonia, Victoria, Tamaulipas, Mexico",Mexico,2016
253,Kersen Science and Technology,"No. 389 Kunjia Road, Kunshan, Jiangsu, China",China,2016
254,Knowles Corp.,"379 Middle Suhong Road, Suzhou Industrial Park, Suzhou, Jiangsu, China",China,2016
255,Knowles Corp.,"Plot 104, Lebuhraya Kampung Jawa, Bayan Lepas Industrial Estate, Penang, Malaysia",Malaysia,2016
256,Kyocera Group,"8 Jing Ci Road, New City District, Shilong Town, Dongguan, Guangdong, China",China,2016
257,Kyocera Group,"1 Mikata, Ayabe, Kyoto, Japan",Japan,2016
258,Kyocera Group,"5850 Higashine-koh ohaza, Higashine-shi, Yamagata, Japan",Japan,2016
259,Kyocera Group,"1166-1 Hebimizo-cho, Higashiomi, Shiga, Japan",Japan,2016
260,Kyocera Group,"1-1 Kokubuyamashita-cho, Kirishima-shi, Kagoshima, Japan",Japan,2016
261,Kyocera Group,"3-1-11 Osachi Kohagi, Okaya, Nagano, Japan",Japan,2016
262,Kyocera Group,"1810 Taki-cho, Satsumasendai, Kagoshima, Japan",Japan,2016
263,Kyocera Group,"560 Nyuzen, Nyuzen-machi, Shimoniikawa-gun, Toyama, Japan",Japan,2016
264,"Laird Technologies, Inc.","28 Huanghe South Road, Kunshan Economic and Tech Development Zone, Kunshan, Jiangsu, China",China,2016
265,"Laird Technologies, Inc.","No. 398 Yuandian Road, Xin Zhuang Industrial Zone, Shanghai, China",China,2016
266,"Laird Technologies, Inc.","No. 8 Pengfeng Road, Songjiang, Shanghai, China",China,2016
267,"Laird Technologies, Inc.","Building 1, Dejin Industrial Park, Fuyuanyi Road, Heping Community, Fuyong Town, Bao An District, Shenzhen, Guangdong, China",China,2016
268,"Largan Precision Co., Ltd.","No. 18, Tutong First Industrial District, Tutong, Changping, Dongguan, Guangdong, China",China,2016
269,"Largan Precision Co., Ltd.","No. 11, Jingke Road, Nantun District, Taichung, Taiwan",Taiwan,2016
270,Lateral Solutions Pte. Ltd.,"Building 3, No. 158, Fengjiang Road, Suzhou, Jiangsu, China",China,2016
271,Lateral Solutions Pte. Ltd.,"No. 6, Century Middle Road, New Century Economic Area, Wuqing, Tianjin, China",China,2016
272,Lateral Solutions Pte. Ltd.,"No. 2 & 4, Jalan Gemilang 3, Kawasan Perindustrian Desa Cemerlang, Ulu Tiram, Johor, Malaysia",Malaysia,2016
273,"Lens One Technology Co., Ltd.","Huangxing Road, Langli Town, Changsha, Hunan, China",China,2016
274,"Lens One Technology Co., Ltd.","Lens Technology Zone, Liuyang Biomedical Industrial Estate, Changsha, Hunan, China",China,2016
275,LG Chem Ltd.,"No. 17 Hengyi Road,Nanjing Economic & Technology Development Zone, Nanjing, Jiangsu, China",China,2016
276,LG Chem Ltd.,"8B Ochang Scientific Local Industrial Complex 1114-Namchon-ri Oksan- Myeon, Cheungwon-Gun, Chungcheongbuk-Do, South Korea",South Korea,2016
277,"LG Display Co., Ltd.","No. 59, Kaitai Road, Science City of Guangzhou, High-Tech Industrial Development Zone, Guangzhou, Guangdong, China",China,2016
278,"LG Display Co., Ltd.","No. 1, LG Road, LG Industrial Park, Nanjing Economic and Technology Development Zone, Nanjing, Jiangsu, China",China,2016
279,"LG Display Co., Ltd.","No. 2 Beijing Middle Road, Development Zone, Yantai, Shandong, China",China,2016
280,"LG Display Co., Ltd.","42-3, Jinpyung-dong, Gumi, Gyeongsangbuk-do, South Korea",South Korea,2016
281,"LG Display Co., Ltd.","1007, Deoguen-ri, Wollong-myeon, Paju, Gyeonggi-Do, South Korea",South Korea,2016
282,"LG Innotek Co., Ltd.","154-6 SanHo-daero, Gumi, Gyeongsangbuk-do, South Korea",South Korea,2016
283,"LG Innotek Co., Ltd.","50-9, Suchul-daero 7-gil, Gumi, Gyeongsangbuk-do, South Korea",South Korea,2016
284,"LG Innotek Co., Ltd.","66 Suchul Saero 9 Gil, Gumi, Gyeongsangbuk-do, South Korea",South Korea,2016
285,"LG Innotek Co., Ltd.","Lot I-4, Trang Due Industrial Park, An Duong district, Hai Phong City, Haiphong, Vietnam",Vietnam,2016
286,Linear Technology Corp.,"Plot 21(B), Phase 4, Bayan Lepas Free Industrial Zone, Bayan Lepas, Penang, Malaysia",Malaysia,2016
287,Linear Technology Corp.,"4200 N.W. Pacific Rim Blvd., Camas, Washington, United States",United States,2016
288,Linear Technology Corp.,"1630 McCarthy Blvd, Milpitas, California, United States",United States,2016
289,Lite-On Technology Corp.,"Av. Torquato Tapajos 7891, Tarum, Manaus, Brazil",Brazil,2016
290,Lite-On Technology Corp.,"No. 88, Yanghu Road, Wujin Hi-Tech Industrial Development Zone, Changzhou, Jiangsu, China",China,2016
291,Lite-On Technology Corp.,"No. 1 ZhenAn Road, Shangjiao Section, ChangAn Town, Dongguan, Guangdong, China",China,2016
292,Lite-On Technology Corp.,"59 Hong Jing Road, Eastern Section, GETDD, Guangzhou, Guangdong, China",China,2016
293,Lite-On Technology Corp.,"No. 8 Guangbao Road, Science City, Luogang Area, Guangzhou, Guangdong, China",China,2016
294,Lite-On Technology Corp.,"1-3/F, Block 9 & 1F, Block 8, Brightman Industrial Zone, Busha Road, Shenzhen, Guangdong, China",China,2016
295,Lite-On Technology Corp.,"No. 11 Fuyuan Road, Wuqing Development Area, Tianjin, China",China,2016
296,Lite-On Technology Corp.,"Land Lot J7J8 WEPZ, New District, Wuxi, Jiangsu, China",China,2016
297,Lite-On Technology Corp.,"No. 45, ZhuJiang Road, New District, Wuxi, Jiangsu, China",China,2016
298,"Longwell Precision Co., Ltd.","No. 19, 2nd Industrial Avenue, Tang Xia Chong Village, Song Gang Town, Paoan Ward, Shenzhen, Guangdong, China",China,2016
299,Luen Fung Group,"No. 48, Keji Road, Yuquan Industrial District South, Fenggang Town, Dongguan, Guangdong, China",China,2016
300,Luen Fung Group,"No. 50, Keji Road, Yuquan Industrial District South, Fenggang Town, Dongguan, Guangdong, China",China,2016
301,"Lung Te Hsin Plastic Co., Ltd.","Liheng Industrial Zone, Qingxi Town, Dongguan, Guangdong, China",China,2016
302,LUXSHARE-ICT,"No. 8 Yongyang Road, National economic & Technological Development Zone, Chuzhou, Anhui, China",China,2016
303,LUXSHARE-ICT,"No. 1, Lvyin Road, Industrial Park, Jian, Jiangxi, China",China,2016
304,LUXSHARE-ICT,"No. 158 Jinchang Road, Jinxi Town, Kunshan, Jiangsu, China",China,2016
305,LUXSHARE-ICT,"No. 399, Baisheng Road, Jinxi Town, Kunshan, Jiangsu, China",China,2016
306,Marian Inc.,"Floor 2, Building 3, Chaohuilou Technology Industrial Park, 180 Huating Road, Da Lang, Longhua, Shenzhen, Guangdong, China",China,2016
307,Marian Inc.,"Unit 1B, Suchun Industrial Square, 428 Xinglong Street, Suzhou Industrial Park, Suzhou, Jiangsu, China",China,2016
308,Maxim Integrated Products Inc.,"First Philippines Industrial Park, Santo Tomas, Batangas, Philippines",Philippines,2016
309,Maxim Integrated Products Inc.,"Gateway Business Park, Special Export Processing Zone, Baranggay Javalera, Gen Trias, Cavite, Philippines",Philippines,2016
310,Maxim Integrated Products Inc.,"700/114 Amata Nakorn Industrial Estate Moo 5, Tambon Klong Tamru, Muang District, Chonburi, Bangkok, Thailand",Thailand,2016
311,Maxim Integrated Products Inc.,"14320 SW Jenkins Road, Beaverton, Oregon, United States",United States,2016
312,Maxim Integrated Products Inc.,"4401 South Beltwood Parkway, Dallas, Texas, United States",United States,2016
313,Maxim Integrated Products Inc.,"9651 Westover Hills Blvd, San Antonio, Texas, United States",United States,2016
314,Maxim Integrated Products Inc.,"160 Rio Robles, San Jose, California, United States",United States,2016
315,Maxim Integrated Products Inc.,"120 San Gabriel Drive, Sunnyvale, California, United States",United States,2016
316,"Merry Electronics Co., Ltd.","No. 800 Kang Yuan Road, Xiang Cheng Economic Development Zone, Suzhou, Jiangsu, China",China,2016
317,Microchip Technology Inc.,"10 Sam Chuk Street, San Po Kong, Kowloon, Hongkong, China",China,2016
318,Microchip Technology Inc.,"La Chantrerie - BP 70602; 44306 Mamtes Cedex 3, Nantes, France",France,2016
319,Microchip Technology Inc.,"73 Loronggang Ulu Kelang Free Trade Zone, Kuala Lumpur, Malaysia",Malaysia,2016
320,Microchip Technology Inc.,"Vestre Rosten 79, Tiller, Norway",Norway,2016
321,Microchip Technology Inc.,"ACP Bldg., 102 Accuracy Drive, Corner Excellence Ave, Carmelray Industrial Park, 1, Canlubang, Calamba, Laguna, Philippines",Philippines,2016
322,Microchip Technology Inc.,"No. 5 Nan-Ko Road 7, Science-Based Industrial Park, Tainan, Taiwan",Taiwan,2016
323,Microchip Technology Inc.,"14 Moo 1, T. Wangtakien, A., Muangchachemgsao, Chacherngsao, Thailand",Thailand,2016
324,Microchip Technology Inc.,"Unit 6, Mitchell Point, Ensign Way, Hamble-le-Rice, Hampshire, United Kingdom",United Kingdom,2016
325,Microchip Technology Inc.,"1150 East Cheyenne Mountian Blvd, Colorado Springs, Colorado, United States",United States,2016
326,Microchip Technology Inc.,"21015 SE Stark Street, Gresham, Oregon, United States",United States,2016
327,Microchip Technology Inc.,"80 Arkay Drive, Hauppauge, New York, United States",United States,2016
328,Microchip Technology Inc.,"1849 Fortune Dr, San Jose, California, United States",United States,2016
329,Microchip Technology Inc.,"2107 N. First Street, San Jose, California, United States",United States,2016
330,Microchip Technology Inc.,"2325 Orchard Parkway, San Jose, California, United States",United States,2016
331,Microchip Technology Inc.,"71 Vista Montana, San Jose, California, United States",United States,2016
332,Microchip Technology Inc.,"1220 South 52nd Street, Tempe, Arizona, United States",United States,2016
333,Micron Technology Inc.,"Zone B of Shanxi Xian Export Processing Zone, Xin Xi Ave, Xian, Shanxi, China",China,2016
334,Micron Technology Inc.,"89-2, Yamada, Yuwaishida, Akita, Japan",Japan,2016
335,Micron Technology Inc.,"7-10, Yoshikawa Kogyo Danchi, Higashi, Hiroshima, Japan",Japan,2016
336,Micron Technology Inc.,"No. 8 Ang Mo Kio, Avenue 12, Singapore",Singapore,2016
337,Micron Technology Inc.,"No. 429-1 Sanfong Road, Houli District Central Taiwan Science Park, Taichung, Taiwan",Taiwan,2016
338,Micron Technology Inc.,"667, Fuhsing 3rd Road, Hwa Ya Technology Park, Guishan Township, Taoyuan, Taiwan",Taiwan,2016
339,"Minebea Co., Ltd.","No. 5202, Lianxi Road, Jinze Town, Qingpu District, Shanghai, China",China,2016
340,"Minebea Co., Ltd.","No. 1, Tongsheng Road, Suzhou Industrial Park, Suzhou, Jiangsu, China",China,2016
341,"Minebea Co., Ltd.","Ban Wa Hi-Tech Industrial Estate, 92 Moo 1, Tambon Banlen, Bang Pa-In, Ayutthaya, Thailand",Thailand,2016
342,"Minebea Co., Ltd.","5/2 Moo 8, Phaholyothin Road, Km.149 Tambon Nikhom Sang Ton-Eng, Amphoe Muang, Muang Lopburi, Lopburi, Thailand",Thailand,2016
343,"Mitsumi Electric Co., Ltd.","1007-39, Izumisawa, Chitose, Hokkaido, Japan",Japan,2016
344,"Mitsumi Electric Co., Ltd.","MRI Special Economic Zone, Sabang, Danao, Cebu, Philippines",Philippines,2016
345,Molex Inc.,"27 Guangshun Street,Dalian Economic and Technical Development Zone, Dalian, Liaoning, China",China,2016
346,Molex Inc.,"No. 889, Yinglun Road, Waigaoqiao Free Trade Zone, Shanghai, China",China,2016
347,Molex Inc.,"1351-2 Sumiyoshi, Yoshida, Haibara-gun, Shizuoka, Japan",Japan,2016
348,Molex Inc.,"3949-3 Kawanishi, Kanoya, Kagoshima, Japan",Japan,2016
349,Molex Inc.,"2607 Jalan Perusahaan Kawasan Perindustrian, Perai, Penang, Malaysia",Malaysia,2016
350,Molex Inc.,"Calzada Industrial Nuevo Nogales #1115, Nogales, Sonora, Mexico",Mexico,2016
351,Molex Inc.,"No. 110, International Road, Jurong Town, Singapore",Singapore,2016
352,Molex Inc.,"700 Kingbird Road, Lincoln, Nebraska, United States",United States,2016
353,"Murata Manufacturing Co., Ltd.","5F, Bldg H-5, LongHu Processing District, Shantou, Guangdong, China",China,2016
354,"Murata Manufacturing Co., Ltd.","15 Cuijing Road, Shenzhen Grand Industrial Zone, Pingshan New District, Shenzhen, Guangdong, China",China,2016
355,"Murata Manufacturing Co., Ltd.","No. 6, Xingchuang 1st Road, Wuxi Export Processing Zone B Zone, Wuxi, Jiangsu, China",China,2016
356,"Murata Manufacturing Co., Ltd.","Lishan Village, Qianwu Town, Doumen, Zhuhai, Guangdong, China",China,2016
357,"Murata Manufacturing Co., Ltd.","JI. Maligi VIII Lot S-4, Kawasan Industri KIIC, Desa Margakaya, Kecamatan Teluk Jambe, Barat Karawang, Kabupaten Bekasi, Jawa Barat, Indonesia",Indonesia,2016
358,"Murata Manufacturing Co., Ltd.","10-28, Hananomori 2-chome, Awara, Fukui, Japan",Japan,2016
359,"Murata Manufacturing Co., Ltd.","1020, Takibe, Toyoshina, Azumino, Nagano, Japan",Japan,2016
360,"Murata Manufacturing Co., Ltd.","1,13-go, Okamotocho, Echizen, Fukui, Japan",Japan,2016
361,"Murata Manufacturing Co., Ltd.","52, Yanagibashi, Yanagibashimachi, Hakui, Ishikawa, Japan",Japan,2016
362,"Murata Manufacturing Co., Ltd.","Chi-18, Sodanimachi, Hakusan, Ishikawa, Japan",Japan,2016
363,"Murata Manufacturing Co., Ltd.","4-1, Higashiokino 4-chome, Higashiomi, Shiga, Japan",Japan,2016
364,"Murata Manufacturing Co., Ltd.","2308, Kaminaoe, Hikawa-cho, Hikawa-gun, Shimane, Japan",Japan,2016
365,"Murata Manufacturing Co., Ltd.","Chi-53, Ohmachi, Anamizu-Machi, Housu, Ishikawa, Japan",Japan,2016
366,"Murata Manufacturing Co., Ltd.","190, Kashiwagi, Komoro, Nagano, Japan",Japan,2016
367,"Murata Manufacturing Co., Ltd.","Ozowara, Echizen-cho, Nyu-gun, Fukui, Japan",Japan,2016
368,"Murata Manufacturing Co., Ltd.","2-82, 1-chome, Miyukicho, Sabae, Fukui, Japan",Japan,2016
369,"Murata Manufacturing Co., Ltd.","77, Fukumoto, Oku-cho, Setouchi, Okayama, Japan",Japan,2016
370,"Murata Manufacturing Co., Ltd.","11-1, Nakae 4-chome, Sanuma, Hasama-cho, Tome, Miyagi, Japan",Japan,2016
371,"Murata Manufacturing Co., Ltd.","345, Uwano, Toyama, Japan",Japan,2016
372,"Murata Manufacturing Co., Ltd.","Plot 15, Bemban Industrial Park Jalan Bemban, Batu Gajah, Perak, Malaysia",Malaysia,2016
373,"Murata Manufacturing Co., Ltd.","Lo A1 Hoa Khanh Inductrial Zone, Lien Chieu District, Da Nang, Vietnam",Vietnam,2016
374,"Murata Manufacturing Co., Ltd.","No. 6, 9A Road, Bien Hoa Industrial Zone No. 2, Dong Nai, Vietnam",Vietnam,2016
375,"Murata Manufacturing Co., Ltd.","1-3 Thang Long Industrial Park, Dong Anh District, Hanoi, Vietnam",Vietnam,2016
376,"Murata Manufacturing Co., Ltd.","Land Lot No. 55, Long Jiang Industrial Park, Tan Lap Ward, Phuoc Tan District, Tan Lap Ward, Tien Giang, Vietnam",Vietnam,2016
377,Nan Ya Plastics Corp.,"201, ChangJiang South Road, Kunshan Economic & Technical Development Zone, Kunshan, Jiangsu, China",China,2016
378,Nan Ya Plastics Corp.,"No. 338, Section 1 Nankan Road, Taoyuan, Taiwan",Taiwan,2016
379,NEC Tokin Corp.,"78/2 Moo 1, Wellgrow Industrial Estate, Bangna-Trad KM. 36 Road, Homsil, Bang Pakong, Chachoengsao, Thailand",Thailand,2016
380,NEC Tokin Corp.,"Long Binh Techno Park (LOTECO) EPZ, Long Binh Ward, Bien Hoa, Dong Nai, Vietnam",Vietnam,2016
381,"NGK Spark Plug Co., Ltd.","1115 Nanakubo Iijima town, Kami-Ina-gun, Nagano, Japan",Japan,2016
382,Nichia Corp.,"491 Oka, Kaminaka-cho, Anan, Tokushima, Japan",Japan,2016
383,Nichia Corp.,"38-2, Kawamukoichi, Ichiba, Oasa-Cho, Naruto, Tokushima, Japan",Japan,2016
384,Nidec Corp.,"No. 12, Huancheng North Road, Hongye, Industrial District, Tangxia Town, Dongguan, Guangdong, China",China,2016
385,Nidec Corp.,"136 North Science Avenue Extension, Laguna Technopark Special Economic Zone, Binan, Laguna, Philippines",Philippines,2016
386,Nidec Corp.,"Lot I-1d-1, Road N1, SHTP, District 9, Ho Chi Minh, Vietnam",Vietnam,2016
387,Nidec Corp.,"Street No. 18, Tan Thuan Export Processing Zone, District 7, Ho Chi Minh, Vietnam",Vietnam,2016
388,"Nihon Dempa Kogyo Co., Ltd.","No. 20, Zhuyuan Road, Suzhou New District, Suzhou, Jiangsu, China",China,2016
389,"Nihon Dempa Kogyo Co., Ltd.","3-63, Suzuranokacho, Hakodate, Hokkaido, Japan",Japan,2016
390,"Nihon Dempa Kogyo Co., Ltd.","16-1, Shintakayachi, Sakuranome, Furukawa, Osaki, Miyagi, Japan",Japan,2016
391,"Nihon Dempa Kogyo Co., Ltd.","1275-2, Kamihirose, Sayama, Saitama, Japan",Japan,2016
392,"Nissha Printing Co., Ltd.","50 Kamiyobe, Yobe-ku, Himeji, Hyogo, Japan",Japan,2016
393,"Nissha Printing Co., Ltd.","Ro49-1 Uwagimachi, Daishoji, Kaga, Ishikawa, Japan",Japan,2016
394,Nitto Denko Corp.,"Bangkai Road, Guangming Hi-Tech Park, Shenzhen, Guangdong, China",China,2016
395,Nitto Denko Corp.,"No. 468 Suhongzhong Road, Suzhou Industrial Park, Suzhou, Jiangsu, China",China,2016
396,Nitto Denko Corp.,"919, Fuke-cho, Kameyama, Mie, Japan",Japan,2016
397,Nitto Denko Corp.,"455-6, Hongo, Minogo-cho, Onomichi, Hiroshima, Japan",Japan,2016
398,Nitto Denko Corp.,"18 Hirayama Nakahara, Toyohashi, Aichi, Japan",Japan,2016
399,Nitto Denko Corp.,"1043, Gupo-dong, Gumi, Gyeongsangbuk-do, South Korea",South Korea,2016
400,Nitto Denko Corp.,"474, Hyeongok-Ri, Cheongbuk-Myeon, Pyeongtaek, Gyeonggi-Do, South Korea",South Korea,2016
401,NOK Corp.,"No. 1, Shuangdeng Road Weiting Town, Suzhou Industrial Park, Suzhou, Jiangsu, China",China,2016
402,NOK Corp.,"1 Floor, No. 22 Xiang-Ming Road, Xiang-An District, Xiamen, Fujian, China",China,2016
403,NOK Corp.,"No. 2, Pinggong Middle Road, Nanping Science Technology Industrial District, Zhuhai, Guangdong, China",China,2016
404,NOK Corp.,"No. 2006, Huang Yang Road, Doumen Town Doumen District, Zhuhai, Guangdong, China",China,2016
405,NOK Corp.,"2626-19 Sunayama, Kamisu, Ibaraki, Japan",Japan,2016
406,NOK Corp.,"1650-11-1 Okuhara-cho, Ushiku, Ibaraki, Japan",Japan,2016
407,NOK Corp.,"No. 20 Dayou 1st Street, Da-Liao District, Kaohsiung, Taiwan",Taiwan,2016
408,NOK Corp.,"No. 48, Chung-Heng Street, Hsiao-Kang District, Kaohsiung, Taiwan",Taiwan,2016
409,NOK Corp.,"No. 166-21, Liaozibu, Madou District, Tainan, Taiwan",Taiwan,2016
410,NOK Corp.,"560 Moo 2, Bangpa-in Industrial Estate, Udomsorayuth Road, T.Klong-Jik, Bang Pa-In, Ayutthaya, Thailand",Thailand,2016
411,NXP Semiconductors N.V.,"Tianmei Industrial North District A Section, Huangjiang Town, Dongguan, Guangdong, China",China,2016
412,NXP Semiconductors N.V.,"Stresemannallee 101, Hamburg, Germany",Germany,2016
413,NXP Semiconductors N.V.,"PT No. 12687, Tuanku Jaafar, Industrial Park, Seremban, Negeri Sembilan, Malaysia",Malaysia,2016
414,NXP Semiconductors N.V.,"Gertsweg 2, Nijmegen, Netherlands",Netherlands,2016
415,NXP Semiconductors N.V.,"Philips Avenue, Light Industry and Science Park, Diezmo, Cabuyao, Laguna, Philippines",Philippines,2016
416,NXP Semiconductors N.V.,"10 Chin 5th Road N.E.P.Z., Kaohsiung, Taiwan",Taiwan,2016
417,NXP Semiconductors N.V.,"303 Moo 3, Chaengwattana Road, Laksi, Bangkok, Thailand",Thailand,2016
418,NXP Semiconductors N.V.,"Bramhall Moor Lane, Stockport, Cheshire, Hazel Grove, United Kingdom",United Kingdom,2016
419,ON Semiconductor Corp.,"Westerring 15, B-9700, Oudenaarde, Belgium",Belgium,2016
420,ON Semiconductor Corp.,"27A People West Road, Leshan, Sichuan, China",China,2016
421,ON Semiconductor Corp.,"Block A&B, No. 110, Liuxiancun Road, Xili Town, Nanshan District, Shenzhen, Guangdong, China",China,2016
422,ON Semiconductor Corp.,"1 Sutong Road, China-Singapore Suzhou Industrial Park, Suzhou, Jiangsu, China",China,2016
423,ON Semiconductor Corp.,"Bozeny Nemcove 1720, Ronov pod Radhotm, Czech Republic",Czech Republic,2016
424,ON Semiconductor Corp.,"420-711 82-3, Dodang-Dong, Wonmi-District, Bucheon, Gyeonggi-Do, South Korea",South Korea,2016
425,ON Semiconductor Corp.,"Lot 122 Senawang Industrial Estate, Seremban, Negeri Sembilan, Malaysia",Malaysia,2016
426,ON Semiconductor Corp.,"Lot 55, Senawang Industrial Estate, Seremban, Negeri Sembilan, Malaysia",Malaysia,2016
427,ON Semiconductor Corp.,"Golden Mile Business Park, Special Economic Zone, Governors Drive Bo., Maduya, Carmona, Cavite, Philippines",Philippines,2016
428,ON Semiconductor Corp.,"Mactan Export Zone I, Lapulapu, Cebu, Philippines",Philippines,2016
429,ON Semiconductor Corp.,"71 Alps Avenue, Singapore",Singapore,2016
430,ON Semiconductor Corp.,"Gresham Fab, 23400 NE Glisan Street, Gresham, Oregon, United States",United States,2016
431,ON Semiconductor Corp.,"Crestwood Industrial Park, 125 Crestwood Road, MountainTop, Pennsylvania, United States",United States,2016
432,ON Semiconductor Corp.,"1401 N. Kings Road, Nampa, Idaho, United States",United States,2016
433,ON Semiconductor Corp.,"2300 West Buckskin Road, Pocatello, Idaho, United States",United States,2016
434,ON Semiconductor Corp.,"333 Western Ave, South Portland, Maine, United States",United States,2016
435,Panasonic Corp.,"No. 666, Lushan Road New District, Suzhou, Jiangsu, China",China,2016
436,Panasonic Corp.,"No. 1, Xinghua 5th Branch, Xi Qing Economic Development Zone, Tianjin, China",China,2016
437,Panasonic Corp.,"JI.Raya Jakarta Bogor, km.35, Cimanggis, Depok, Indonesia",Indonesia,2016
438,Panasonic Corp.,"Kawasan Industri MM2100 Blok.O-1-1 Kecamatan Cikarang Barat, Kabupaten Bekasi, Jawa Barat, Indonesia",Indonesia,2016
439,Panasonic Corp.,"1037-2 Kamiosatsu, Chitose, Hokkaido, Japan",Japan,2016
440,Panasonic Corp.,"401 Sadamasa, Fukui, Japan",Japan,2016
441,Panasonic Corp.,"1786-6 Tokushige, Ijuin-Cho, Hioki, Kagoshima, Japan",Japan,2016
442,Panasonic Corp.,"Tamiyaji, Tamaki-cho, Watarai-gun, Ise, Mie, Japan",Japan,2016
443,Panasonic Corp.,"369 Nogifukutomi-cho, Matsue, Shimane, Japan",Japan,2016
444,Panasonic Corp.,"4-5-1 Kurihara, Myoko, Niigata, Japan",Japan,2016
445,Panasonic Corp.,"217 Omachi-cho, Omachi, Saga, Japan",Japan,2016
446,Panasonic Corp.,"271 Higashi Kaihatsu, Tonami, Toyama, Japan",Japan,2016
447,Panasonic Corp.,"25 Kowata Nishinaka, Uji, Kyoto, Japan",Japan,2016
448,PCH International,"Block D&E, 4/F, DuShiMingYuan, JinTang Street, CaiWuWei, LuoHu District, Shenzhen, Guangdong, China",China,2016
449,PCH International,"Building 20, Huaning West Road, Hualian Industrial Zone, Dalang Community, Baoan District, Longhua, Shenzhen, Guangdong, China",China,2016
450,PCH International,"4/F Shenli Industrial Park, Sanxiang Town, Zhongshan, Guangdong, China",China,2016
451,Pegatron Corp.,"No. 88, Kaedar Road, Kunshan High-tech Industrial Park, Kunshan, Jiangsu, China",China,2016
452,Pegatron Corp.,"West of Rose Road and South of Bailing Road, Kunshan Development Area, Kunshan, Jiangsu, China",China,2016
453,Pegatron Corp.,"No. 3668, XiuYan Road, Kangqiao Town, Pudong New District, Shanghai, China",China,2016
454,Pegatron Corp.,"No. 233, Jinfeng Road, Suzhou, Jiangsu, China",China,2016
455,Pegatron Corp.,"No. 357, Jinfeng Road, New District Suzhou, Suzhou, Jiangsu, China",China,2016
